{
  "schema_version": "experience_v1_8_context_routing_nervous_system_v1",
  "planting_id": "experience_v1_8_context_routing_nervous_system_center_contract",
  "campaign_wave": "wave8_context_routing_nervous_system",
  "status": "center_context_routing_contract_landed",
  "runtime_effect": "none",
  "live_context_routing_activation": false,
  "live_runtime_activation": false,
  "live_owner_override": false,
  "source_seed": {
    "archive_name": "aoa-experience-context-routing-nervous-system-seed-v1_8.zip",
    "seed_id": "aoa-experience-context-routing-nervous-system-seed-v1_8",
    "version": "v1.8",
    "sha256": "d8ff2d7adfa91fa06c0f1ba17ffe4d45b0c5f343b026a92806b5ec25b3e427c4",
    "claim_limit": "archive_readable_not_owner_ready",
    "no_new_repo": true
  },
  "predecessor_surfaces": [
    "Dionysus:seed_staging/future/seed_aoa_experience_wave0_v1_2_to_v2_0_intake_pack.md",
    "Dionysus:seed_staging/future/seed_aoa_experience_wave0_v1_2_to_v2_0_intake_pack.map.yaml",
    "mechanics/experience/legacy/raw/EXPERIENCE_V1_2_TO_V2_0_BRIDGE.md",
    "mechanics/experience/legacy/raw/EXPERIENCE_V1_2_SERVICE_MESH_OPERATIONS.md",
    "mechanics/experience/legacy/raw/EXPERIENCE_V1_3_OFFICE_FOUNDRY_ROLE_PAIRS.md",
    "mechanics/experience/legacy/raw/EXPERIENCE_V1_4_AGONIC_PAIR_TRIALS_MECHANICAL_ARENA_KERNEL.md",
    "mechanics/experience/legacy/raw/EXPERIENCE_V1_5_EPISTEMIC_DUEL_MODEL_OF_OTHER_FORGE.md",
    "mechanics/experience/legacy/raw/EXPERIENCE_V1_6_EPISTEMIC_MEMORY_RANK_REPUTATION_ENGINE.md",
    "mechanics/experience/legacy/raw/EXPERIENCE_V1_7_AFFECTIVE_ECONOMY_HONOR_TREASURY.md",
    "mechanics/experience/legacy/raw/EXPERIENCE_AGON_SERVICE_SEAM_V1_1.md",
    "mechanics/experience/legacy/raw/EXPERIENCE_RUNTIME_AUTHORITY_BOUNDARY.md",
    "mechanics/experience/legacy/raw/EXPERIENCE_AUTHORITY_RESOLVER.md",
    "mechanics/experience/legacy/raw/EXPERIENCE_TOS_CANDIDATE_BOUNDARY.md",
    "mechanics/experience/legacy/raw/EXPERIENCE_REPO_LANDING_ORDER.md",
    "mechanics/method-growth/docs/CANDIDATE_LINEAGE_CROSSWALK.md",
    "mechanics/method-growth/docs/OWNER_LANDING_AND_PRUNING.md",
    "mechanics/agon/docs/AGON_PRE_PROTOCOL_STOP_LINES.md",
    "mechanics/agon/docs/AGON_GATE_ROUTING_HANDOFF.md",
    "mechanics/agon/docs/AGON_GATE_ROUTING_STOP_LINES.md",
    "mechanics/agon/docs/AGON_TRIAL_PLAYBOOK_HANDOFF.md",
    "mechanics/agon/docs/AGON_TRIAL_PLAYBOOK_STOP_LINES.md",
    "mechanics/agon/docs/AGON_WAVE7_CENTER_HANDOFF.md",
    "mechanics/agon/docs/AGON_COURT_MEMO_STATS_PREBINDING_HANDOFF.md",
    "mechanics/agon/docs/AGON_COURT_MEMO_STATS_PREBINDING_STOP_LINES.md"
  ],
  "context_routing_law": [
    "no_new_repo_creation",
    "no_routing_without_reason_budget_and_receipt",
    "no_owner_meaning_theft",
    "no_salience_as_authority",
    "no_codex_context_override",
    "no_assistant_context_expansion_or_personal_overreach",
    "no_affect_or_rank_direct_rights_route",
    "no_service_to_agon_without_lawful_trigger",
    "no_direct_tree_of_sophia_write",
    "no_durable_memory_or_retention_execution",
    "no_runtime_cache_worker_or_scheduler_activation",
    "no_stats_memo_or_routing_as_authority"
  ],
  "context_requests": [
    {
      "request": "context_signal_collection_review",
      "owner": "aoa-routing",
      "input_boundary": "task scope service state agonic pressure affect rank memory and canonical-risk signals",
      "output_candidate": "context_signal_candidate",
      "must_include": [
        "task_scope",
        "signal_refs",
        "candidate_layers",
        "non_authoritative_label"
      ],
      "must_not_include": [
        "owner_override",
        "verdict",
        "rights_grant",
        "direct_tos_write"
      ],
      "live_execution": false,
      "authority": "routing_candidate_only"
    },
    {
      "request": "salience_budget_review",
      "owner": "aoa-routing",
      "input_boundary": "signal set salience ordering attention budget route reason and receipt requirement",
      "output_candidate": "salience_budget_candidate",
      "must_include": [
        "salience_vector",
        "attention_budget",
        "route_reason",
        "receipt_required"
      ],
      "must_not_include": [
        "budgetless_expansion",
        "salience_as_authority",
        "automatic_escalation",
        "hidden_context_pull"
      ],
      "live_execution": false,
      "authority": "routing_candidate_only"
    },
    {
      "request": "assistant_personal_context_boundary_review",
      "owner": "aoa-agents",
      "input_boundary": "assistant service scope personal context trigger minimization posture and reversible expansion boundary",
      "output_candidate": "assistant_personal_context_candidate",
      "must_include": [
        "service_scope",
        "personal_context_minimized",
        "expansion_trigger",
        "reversible_posture"
      ],
      "must_not_include": [
        "assistant_self_override",
        "private_context_lock_in",
        "persona_seal",
        "verdict_authority"
      ],
      "live_execution": false,
      "authority": "actor_posture_candidate_only"
    },
    {
      "request": "memo_reentry_review",
      "owner": "aoa-memo",
      "input_boundary": "route receipt stale ttl reentry need and bounded non-durable memory intake posture",
      "output_candidate": "memo_reentry_candidate",
      "must_include": [
        "receipt_ref",
        "stale_ttl",
        "candidate_only",
        "non_durable_intake"
      ],
      "must_not_include": [
        "durable_memory_write",
        "retention_execution",
        "identity_truth_seal",
        "hidden_scheduler"
      ],
      "live_execution": false,
      "authority": "candidate_intake_only"
    },
    {
      "request": "route_integrity_review",
      "owner": "aoa-evals",
      "input_boundary": "layer selection trace boundary checks escalation basis and human review posture",
      "output_candidate": "route_integrity_candidate",
      "must_include": [
        "layer_selection_trace",
        "boundary_checks",
        "route_reason",
        "human_review_needed"
      ],
      "must_not_include": [
        "routing_sovereignty",
        "rights_grant",
        "sealed_verdict",
        "owner_override"
      ],
      "live_execution": false,
      "authority": "bounded_eval_request_only"
    },
    {
      "request": "canonical_dossier_boundary_review",
      "owner": "Tree-of-Sophia",
      "input_boundary": "canonical risk trace dossier path review requirement and no direct write boundary",
      "output_candidate": "canonical_dossier_candidate",
      "must_include": [
        "canonical_risk_trace",
        "review_path",
        "candidate_only",
        "no_direct_write"
      ],
      "must_not_include": [
        "canon_entry",
        "direct_tos_write",
        "automatic_promotion",
        "hidden_dossier_write"
      ],
      "live_execution": false,
      "authority": "dossier_boundary_candidate_only"
    },
    {
      "request": "derived_observability_review",
      "owner": "aoa-stats",
      "input_boundary": "reviewed route packets for bounded summaries only",
      "output_candidate": "context_observability_candidate",
      "must_include": [
        "derived_only",
        "source_refs",
        "non_authoritative_label",
        "review_trace"
      ],
      "must_not_include": [
        "route_verdict",
        "owner_truth",
        "rights_authority",
        "hidden_trigger"
      ],
      "live_execution": false,
      "authority": "derived_surface_only"
    }
  ],
  "routing_flow": [
    {
      "order": 1,
      "kind": "source_seed_received",
      "owner": "Agents-of-Abyss",
      "authority_note": "Dionysus archive is transport evidence; center may name v1.8 context routing law only",
      "stop_lines": [
        "no raw archive replay",
        "no generated clean-flow promotion"
      ]
    },
    {
      "order": 2,
      "kind": "wave7_affect_predecessor_checked",
      "owner": "Agents-of-Abyss",
      "authority_note": "v1.7 remains predecessor law; routing may activate layers only after affect rank and rights boundaries are already candidate-bound",
      "stop_lines": [
        "no predecessor erasure",
        "no wave8 collision with arena-session law"
      ]
    },
    {
      "order": 3,
      "kind": "context_routing_charter_requested",
      "owner": "Agents-of-Abyss",
      "authority_note": "charter is required before any owner-local routing engine policy or packet surface can land",
      "stop_lines": [
        "no new aoa-experience repo",
        "no center-created router engine"
      ]
    },
    {
      "order": 4,
      "kind": "context_signal_collection_requested",
      "owner": "aoa-routing",
      "authority_note": "routing may collect bounded cross-layer signals but cannot author owner meaning or pull hidden context",
      "stop_lines": [
        "no hidden context pull",
        "no owner meaning theft"
      ]
    },
    {
      "order": 5,
      "kind": "salience_and_budget_review_requested",
      "owner": "aoa-routing",
      "authority_note": "salience and budget may prioritize layers but can never become authority or budgetless expansion",
      "stop_lines": [
        "no budgetless expansion",
        "no salience as authority"
      ]
    },
    {
      "order": 6,
      "kind": "assistant_and_personal_context_boundary_checked",
      "owner": "aoa-agents",
      "authority_note": "assistant scope and personal context minimization stay actor-bound and reversible never self-authorizing",
      "stop_lines": [
        "no assistant context expansion",
        "no personal context overreach"
      ]
    },
    {
      "order": 7,
      "kind": "context_bundle_boundary_checked",
      "owner": "aoa-evals",
      "authority_note": "route bundles require traceable reasons layer selection boundary checks and receipt expectation before legitimacy can advance",
      "stop_lines": [